Metals,Effects,Reference
**Mercury**,"Nervous system disorders (loss of memory, sensorimotor polyneuropathy, hallucinations, neurodegenerative diseases in adults such as Alzheimer's and Parkinson's diseases) ",[@Carocci2014ts; @Counter2004vl; @Weiss2002wd]
,"Enzyme, immune, and genetic disorders",[@Andreoli2017tc; @Engwa19] 
,Minamata disease in Japan and poisoning in Iraq,[@Gochfeld2003ue] 
,"Fever, malaise, hallucinations, delusions, gingivitis, and cough ",[@WHO1991]
,"Weight loss, insomnia, erythema, and renal tubular dysfunction",[@Weldon2000tw]